Name,Custodian,Caption,Description,Data type,Purpose,Attribution,Source Link,Citation,Institution,Image Link,Longitude,Latitude,Date,Title,Text Box,Gravatar,Tag One,Tag Two,Tag Three,Tag Four,SubTitle1,SubText1,SubTitle2,SubText2,SubTitle3,SubText3
1915 Typhoid Mary Exiled to North Brother Island Permanently,Bri,"1915: Being unable to make a living in other work, Mary Mallon resumes cooking and is tied to more typhoid outbreaks and subsequently forced to live the last 23 years of her life in exile on North Brother Island.",Date of Typhoid Mary being permanently exiled to North Brother Island,Text,Horizontal timeline marker,,https://untappedcities.com/2020/03/13/the-strange-story-of-typhoid-mary-quarantined-on-north-brother-island/ AND https://www.theguardian.com/science/2020/mar/10/typhoid-mary-super-spreader-history,"Sheidlower, Noah. “The Strange Story of Typhoid Mary, Quarantined on North Brother Island.” Untapped New York, 13 Mar. 2020, https://untappedcities.com/2020/03/13/the-strange-story-of-typhoid-mary-quarantined-on-north-brother-island/. Accessed 31 Mar. 2021. AND Carroll, Rory. “Typhoid Mary: The Super-Spreader before the Term Even Existed.” The Guardian, 10 Mar. 2020, http://www.theguardian.com/science/2020/mar/10/typhoid-mary-super-spreader-history. Accessed 31 Mar. 2021.",Untapped New York and The Guardian,,,,1915,,,,Epidemic,,,,,,,,,
1916 Polio Death Toll,Bri,"1916: Polio infects several thousand people, and kills more than 2,000",Date of polio outbreak and death toll,Text,Horizontal timeline marker,,https://untappedcities.com/2020/03/20/12-epidemics-that-plagued-new-york/,"Sheidlower, Noah. “12 Prior Epidemics That Plagued New York.” Untapped New York, 20 Mar. 2020, https://untappedcities.com/2020/03/20/12-epidemics-that-plagued-new-york/. Accessed 23 Mar. 2021.",Untapped New York,,,,1916,,,,Epidemic,,,,,,,,,
1918 Influenza Death Toll,Bri,"1918: Influenza epidemic kills more than 30,000",Date of influenza epidemic with death toll in New York City,Text,Horizontal timeline marker,,https://www.mcny.org/story/germ-city-epidemics-throughout-new-yorks-history,"Hazelwood, Madeleine. “Germ City: Epidemics throughout New York’s History.” Museum of the City of New York, 23 Oct. 2018, https://www.mcny.org/story/germ-city-epidemics-throughout-new-yorks-history. Accessed 23 Mar. 2021.",Museum of the City of New York,,,,1918,,,,Epidemic,,,,,,,,,
1981 AIDS Crisis Begins,Bri,1981: Doctors begin seeing first cases new disease (AIDS),Date that doctors first began noticing what has become known as AIDS,Text,Horizontal timeline marker,,https://www.nycaidsmemorial.org/timeline,"“HIV/AIDS Timeline.” New York City AIDS Memorial, https://www.nycaidsmemorial.org/timeline. Accessed 23 Mar. 2021.",New York City AIDS Memorial,,,,1981,,,,Epidemic,,,,,,,,,
1991 construction begins on federal office building and human remains are uncovered / bodies are transported to DC for study,lane,1991: Construction begins on modern day plot and human remains are uncovered / Bodies are transported to DC for analysis at Howard University,"Date that construction begins on federal office building located on modern day plot and human remains are uncovered by excavation workers / Date that human remains of 419 women, men, and children are transported to DC for analysis at Howard University which will last for 12 years",Text,Horizontal timeline marker,,https://www.nps.gov/afbg/learn/historyculture/african-burial-ground-in-history.htm,"Moore, Christopher. “African Burial Ground in History.” African Burial Ground National Monument, https://www.nps.gov/afbg/learn/historyculture/african-burial-ground-in-history.htm. Accessed 23 Mar. 2021.",,,,,1991,,,,Event,African,,,,,,,,
1994 AIDS Death Toll,Bri,"1994: Almost 50,000 New Yorkers have died from AIDS",Date at heigh of AIDS epidemic with death toll,Text,Horizontal timeline marker,,https://nymag.com/intelligencer/2014/05/memories-aids-new-york.html,"Murphy, Tim. “7 New Yorkers Remember the Early Days of the AIDS Epidemic.” Intelligencer, 29 May 2014, https://nymag.com/intelligencer/2014/05/memories-aids-new-york.html. Accessed 23 Mar. 2021.",Intelligencer,,,,1994,,,,Epidemic,,,,,,,,,
1999 nine intact burials are uncovered during construction ,lane,1999: Nine intact burials are uncovered during construction near initial discovery,Date that nine intact burials are discovered on the southern edge of the historic ground during construction of the new sidewalk in front of Tweed Building on Chambers Street,Text,Horizontal timeline marker,,https://www.nps.gov/afbg/learn/historyculture/african-burial-ground-in-history.htm,"Moore, Christopher. “African Burial Ground in History.” African Burial Ground National Monument, https://www.nps.gov/afbg/learn/historyculture/african-burial-ground-in-history.htm. Accessed 23 Mar. 2021.",,,,,1999,,,,Event,African,,,,,,,,
2003 bodies and remains are returned to resting place during Rites of Ancestral Return,lane,2003: Rites of Ancestral Return,"Date that some 10,000 participants of the ""Rites of Ancestral Return"" aid in the transportation and re-entering of the ancestral remains to rest on the perserved portion of the site (each in a hand-carved wooden coffin from Ghana)",Text,Horizontal timeline marker,,https://www.nps.gov/afbg/learn/historyculture/african-burial-ground-in-history.htm,"Moore, Christopher. “African Burial Ground in History.” African Burial Ground National Monument, https://www.nps.gov/afbg/learn/historyculture/african-burial-ground-in-history.htm. Accessed 23 Mar. 2021.",,,,,2003,,,,Event,African,,,,,,,,
2007 ABNM becomes first national monument dedicated to Africans of early New York and Americans of African descent,lane,2007: African Burial Ground National Monument becomes first national monument dedicated to Africans of early New York and Americans of African descent,Date when the African Burial Ground National Monument became the first national monument dedicated to Africans of early New York as well as Americans of African descent,Text,Horizontal timeline marker,,https://www.nps.gov/afbg/learn/historyculture/african-burial-ground-in-history.htm,"Moore, Christopher. “African Burial Ground in History.” African Burial Ground National Monument, https://www.nps.gov/afbg/learn/historyculture/african-burial-ground-in-history.htm. Accessed 23 Mar. 2021.",,,,,2007,,,,Event,African,,,,,,,,
2020 COVID-19 Begins,Bri,2020: First COVID-19 case confirmed in city on March 1,Date of first confirmed COVID-19 case in New York City,Text,Horizontal timeline marker,,https://www.nytimes.com/2020/03/01/nyregion/new-york-coronvirus-confirmed.html,"Goldstein, Joseph, and Jesse McKinley. “Coronavirus in N.Y.: Manhattan Woman Is First Confirmed Case in State.” The New York Times, 2 Mar. 2020. NYTimes.com, https://www.nytimes.com/2020/03/01/nyregion/new-york-coronvirus-confirmed.html. Accessed 23 Mar. 2021.",The New York Times,,,,2020,,,,Epidemic,,,,,,,,,
