Name,Custodian,Caption,Description,Data type,Purpose,Attribution,Source Link,Citation,Institution,Image Link,Longitude,Latitude,Date,Title,Text Box,Gravatar,Tag One,Tag Two,Tag Three,Tag Four,SubTitle1,SubText1,SubTitle2,SubText2,SubTitle3,SubText3
2007 ABNM becomes first national monument dedicated to Africans of early New York and Americans of African descent,lane,2007: African Burial Ground National Monument became first national monument dedicated to Africans of early New York and Americans of African descent,Date when the African Burial Ground National Monument became the first national monument dedicated to Africans of early New York as well as Americans of African descent,Text,Horizontal timeline marker,,https://www.nps.gov/afbg/learn/historyculture/african-burial-ground-in-history.htm,"Moore, Christopher. “African Burial Ground in History.” African Burial Ground National Monument, https://www.nps.gov/afbg/learn/historyculture/african-burial-ground-in-history.htm. Accessed 23 Mar. 2021.",,,,,2007,,,,African,Reinterment,Hidden,Power,,,,,,
The Mystery of the Flying Kicks (2014).,Asma,Shoe-hanging on the powerlines running across street intersection. Seen in the 2014The Mystery of the Flying Kicks (Bate).,"Real coordinates of Shoe-Hangings located in Queens NY at the time of this Timeline are located on the Map page of Mapping Cemeteries. The image above is from the 2014 Film, The Mystery of the flying Kicks, directed by Matthew Bate. It is provided to visualize this memorial project without using primary source images that require more research advisement on ethics.",Image,"Location page, Shoe-Hangings seen in film culture.",,,"Bate, M. (2014). The Mystery of the Flying Kicks.",,https://mappingcemeteries.commons.gc.cuny.edu/wp-content/blogs.dir/16656/files/2021/05/Shoe-Hanging-As-Memory-Credit-Matthew-Bate-Film-TheMysteryofFlyingKicks-2010-SXSW-Debut.png,,,2014,Shoe-Hanging in Film Culture(part 2),,https://unsplash.com/photos/vDyhn5dM1wg?utm_source=unsplash&utm_medium=referral&utm_content=creditShareLink,Hidden,hangings,,,,,,,,
2020 COVID-19 Begins,Bri,2020: First COVID-19 case was confirmed in city on March 1,Date of first confirmed COVID-19 case in New York City,Text,Horizontal timeline marker,,https://www.nytimes.com/2020/03/01/nyregion/new-york-coronvirus-confirmed.html,"Goldstein, Joseph, and Jesse McKinley. “Coronavirus in N.Y.: Manhattan Woman Is First Confirmed Case in State.” The New York Times, 2 Mar. 2020.",The New York Times,,,,2020,,,,Disease,,,,,,,,,
"Queens, NY ",Asma,"An image representation from film, Concrete Cowboy (2021) for the Queens, NY coordinates captured by Project Manager, Bri Caszatt, in Spring 2021. ",,Image,"Location Page, second data point (chronologically) that visualizes deathscape to the MC audience. ",,,"Staub, D. (2021) Concrete Cowboy. BlackPast, B. (2008, September 22). (1909) Ida B. Wells, “Lynching, Our National Crime”. BlackPast.org. https://www.blackpast.org/african-american-history/1909-ida-b-wells-awful-slaughter/",,https://mappingcemeteries.commons.gc.cuny.edu/wp-content/blogs.dir/16656/files/2021/05/Staub-Concrete-Cowboy-2021-Shoe-Hanging.png,73.91725183,40.74095743,2020,"Shoe-Hanging(s), Queens, NY",,https://unsplash.com/photos/vDyhn5dM1wg?utm_source=unsplash&utm_medium=referral&utm_content=creditShareLink,queens,embodied,hidden,,,,,,,
2021 - A Love Song for Latasha (part 1),Asma,"Sneakers tied at the laces on Powerline, with its location ""South Central Los Angles, CA"" inscribed in the center. ","A pair of shoes hanging on the powerlines with its location ""South Central Los Angles, CA"" inscribed in the center. Seen in the 2020 trailer and film, A Love Song for Latasha (Allison). This documetnary debuted in 2021 on Netflix.",Image,Horizontal timeline and location page,Netflix/YouTube,,"Allison, Nahli, S. (2019). A Love Song for Latasha. ",,https://mappingcemeteries.commons.gc.cuny.edu/wp-content/blogs.dir/16656/files/2021/05/Allison-A-Love-Song-for-Latasha-2020-MCSP21.png,,,2021,Audio as a Mode of Mapping  ,,https://unsplash.com/photos/vDyhn5dM1wg?utm_source=unsplash&utm_medium=referral&utm_content=creditShareLink,Hidden,Power,,,,,,,,
